{
  "version": "1.0",
  "schema_sha256": "a61ab87058918ee2cdaa778b690a09f3f5796c01ee343a699bf5fbe83435c54d",
  "renderer_environment": {
    "renderer_build_id": "renderer_build_01",
    "code_sha256": "1111111111111111111111111111111111111111111111111111111111111111",
    "package_lock_sha256": "2222222222222222222222222222222222222222222222222222222222222222",
    "release_sha256": "3333333333333333333333333333333333333333333333333333333333333333",
    "node_version": "v24.0.0",
    "chromium_version": "138.0.0",
    "ffmpeg_version": "7.1.1",
    "ffprobe_version": "7.1.1",
    "locale": "C.UTF-8",
    "timezone": "UTC"
  },
  "output_spec": {
    "ratio": "16:9",
    "width": 1920,
    "height": 1080,
    "fps_num": 30,
    "fps_den": 1,
    "video_codec": "h264",
    "pixel_format": "yuv420p",
    "audio_codec": "aac",
    "sample_rate": 48000,
    "channels": 2
  },
  "duration_ms": 4000,
  "edit_plan_sha256": "4444444444444444444444444444444444444444444444444444444444444444",
  "registry_sha256": "5555555555555555555555555555555555555555555555555555555555555555",
  "theme": {
    "palette_id": "midnight_gold",
    "typography_id": "editorial_sans",
    "density": "balanced",
    "motion_energy": "medium",
    "image_fit": "cover"
  },
  "seed": 42,
  "source_video": {
    "path": "media/source.mp4",
    "sha256": "0cab1c9617404faf2b24e221e189ca5945813e14d3f766345b09ca13bbe28ffc",
    "size_bytes": 5,
    "silent": true,
    "duration_ms": 5000,
    "width": 1920,
    "height": 1080
  },
  "source_segments": [
    {
      "id": "segment_01",
      "source_path": "media/source.mp4",
      "sha256": "0cab1c9617404faf2b24e221e189ca5945813e14d3f766345b09ca13bbe28ffc",
      "source_start_ms": 100,
      "source_end_ms": 4100,
      "output_start_ms": 0,
      "output_end_ms": 4000
    }
  ],
  "master_audio": {
    "path": "media/master.wav",
    "sha256": "6ed8919ce20490a5e3ad8630a4fab69475297abd07db73918dd5f36fcfaeb11b",
    "size_bytes": 5,
    "duration_ms": 4000,
    "sample_rate": 48000,
    "channels": 2
  },
  "assets": [
    {
      "id": "asset_01",
      "kind": "image",
      "path": "media/image.png",
      "sha256": "6105d6cc76af400325e94d588ce511be5bfdbb73b437dc51eca43917d7a43e3d",
      "size_bytes": 5
    }
  ],
  "compositions": [
    {
      "id": "composition_01",
      "scene_id": "scene_01",
      "start_ms": 0,
      "end_ms": 4000,
      "layout_id": "speaker_right_evidence_left",
      "layout_variant": "balanced_a",
      "overlay_ids": ["headline_block", "info_card"],
      "animations": [
        {
          "target": "headline_block",
          "preset": "fade",
          "direction": "none",
          "duration_ms": 400,
          "delay_ms": 0
        }
      ],
      "transition": "hard_cut",
      "asset_ids": ["asset_01"]
    }
  ],
  "captions": [
    {
      "id": "caption_01",
      "start_ms": 0,
      "end_ms": 2000,
      "text": "真实方法"
    },
    {
      "id": "caption_02",
      "start_ms": 2000,
      "end_ms": 4000,
      "text": "提升效率"
    }
  ]
}
